[
  {
    "schema_version": "0.1.0",
    "id": "urn:lex-mx:federal:statute:lges:article:1:term-usage:85-92",
    "provision_id": "urn:lex-mx:federal:statute:lges:article:1",
    "term_id": "urn:lex-mx:federal:statute:lges:term:estado",
    "span": "Estados",
    "start_char": 85,
    "end_char": 92
  },
  {
    "schema_version": "0.1.0",
    "id": "urn:lex-mx:federal:statute:lges:article:1:term-usage:605-611",
    "provision_id": "urn:lex-mx:federal:statute:lges:article:1",
    "term_id": "urn:lex-mx:federal:statute:lges:term:estado",
    "span": "Estado",
    "start_char": 605,
    "end_char": 611
  },
  {
    "schema_version": "0.1.0",
    "id": "urn:lex-mx:federal:statute:lges:article:1:term-usage:1388-1394",
    "provision_id": "urn:lex-mx:federal:statute:lges:article:1",
    "term_id": "urn:lex-mx:federal:statute:lges:term:estado",
    "span": "Estado",
    "start_char": 1388,
    "end_char": 1394
  },
  {
    "schema_version": "0.1.0",
    "id": "urn:lex-mx:federal:statute:lges:article:2:term-usage:242-249",
    "provision_id": "urn:lex-mx:federal:statute:lges:article:2",
    "term_id": "urn:lex-mx:federal:statute:lges:term:estado",
    "span": "Estados",
    "start_char": 242,
    "end_char": 249
  },
  {
    "schema_version": "0.1.0",
    "id": "urn:lex-mx:federal:statute:lges:article:2:term-usage:1852-1859",
    "provision_id": "urn:lex-mx:federal:statute:lges:article:2",
    "term_id": "urn:lex-mx:federal:statute:lges:term:estado",
    "span": "Estados",
    "start_char": 1852,
    "end_char": 1859
  },
  {
    "schema_version": "0.1.0",
    "id": "urn:lex-mx:federal:statute:lges:article:3:term-usage:159-165",
    "provision_id": "urn:lex-mx:federal:statute:lges:article:3",
    "term_id": "urn:lex-mx:federal:statute:lges:term:estado",
    "span": "Estado",
    "start_char": 159,
    "end_char": 165
  },
  {
    "schema_version": "0.1.0",
    "id": "urn:lex-mx:federal:statute:lges:article:3:term-usage:243-250",
    "provision_id": "urn:lex-mx:federal:statute:lges:article:3",
    "term_id": "urn:lex-mx:federal:statute:lges:term:estado",
    "span": "Estados",
    "start_char": 243,
    "end_char": 250
  },
  {
    "schema_version": "0.1.0",
    "id": "urn:lex-mx:federal:statute:lges:article:3:term-usage:315-321",
    "provision_id": "urn:lex-mx:federal:statute:lges:article:3",
    "term_id": "urn:lex-mx:federal:statute:lges:term:estado",
    "span": "Estado",
    "start_char": 315,
    "end_char": 321
  },
  {
    "schema_version": "0.1.0",
    "id": "urn:lex-mx:federal:statute:lges:article:4:term-usage:97-104",
    "provision_id": "urn:lex-mx:federal:statute:lges:article:4",
    "term_id": "urn:lex-mx:federal:statute:lges:term:estado",
    "span": "Estados",
    "start_char": 97,
    "end_char": 104
  },
  {
    "schema_version": "0.1.0",
    "id": "urn:lex-mx:federal:statute:lges:article:4:term-usage:188-194",
    "provision_id": "urn:lex-mx:federal:statute:lges:article:4",
    "term_id": "urn:lex-mx:federal:statute:lges:term:estado",
    "span": "Estado",
    "start_char": 188,
    "end_char": 194
  },
  {
    "schema_version": "0.1.0",
    "id": "urn:lex-mx:federal:statute:lges:article:4:term-usage:721-727",
    "provision_id": "urn:lex-mx:federal:statute:lges:article:4",
    "term_id": "urn:lex-mx:federal:statute:lges:term:estado",
    "span": "Estado",
    "start_char": 721,
    "end_char": 727
  },
  {
    "schema_version": "0.1.0",
    "id": "urn:lex-mx:federal:statute:lges:article:6:term-usage:1271-1277",
    "provision_id": "urn:lex-mx:federal:statute:lges:article:6",
    "term_id": "urn:lex-mx:federal:statute:lges:term:estado",
    "span": "Estado",
    "start_char": 1271,
    "end_char": 1277
  },
  {
    "schema_version": "0.1.0",
    "id": "urn:lex-mx:federal:statute:lges:article:6:term-usage:1985-1992",
    "provision_id": "urn:lex-mx:federal:statute:lges:article:6",
    "term_id": "urn:lex-mx:federal:statute:lges:term:estado",
    "span": "Estados",
    "start_char": 1985,
    "end_char": 1992
  },
  {
    "schema_version": "0.1.0",
    "id": "urn:lex-mx:federal:statute:lges:article:6:term-usage:2171-2177",
    "provision_id": "urn:lex-mx:federal:statute:lges:article:6",
    "term_id": "urn:lex-mx:federal:statute:lges:term:estado",
    "span": "Estado",
    "start_char": 2171,
    "end_char": 2177
  },
  {
    "schema_version": "0.1.0",
    "id": "urn:lex-mx:federal:statute:lges:article:6:term-usage:2452-2458",
    "provision_id": "urn:lex-mx:federal:statute:lges:article:6",
    "term_id": "urn:lex-mx:federal:statute:lges:term:estado",
    "span": "Estado",
    "start_char": 2452,
    "end_char": 2458
  },
  {
    "schema_version": "0.1.0",
    "id": "urn:lex-mx:federal:statute:lges:article:6:term-usage:2743-2749",
    "provision_id": "urn:lex-mx:federal:statute:lges:article:6",
    "term_id": "urn:lex-mx:federal:statute:lges:term:estado",
    "span": "Estado",
    "start_char": 2743,
    "end_char": 2749
  },
  {
    "schema_version": "0.1.0",
    "id": "urn:lex-mx:federal:statute:lges:article:8:term-usage:3215-3221",
    "provision_id": "urn:lex-mx:federal:statute:lges:article:8",
    "term_id": "urn:lex-mx:federal:statute:lges:term:estado",
    "span": "Estado",
    "start_char": 3215,
    "end_char": 3221
  },
  {
    "schema_version": "0.1.0",
    "id": "urn:lex-mx:federal:statute:lges:article:9:term-usage:162-169",
    "provision_id": "urn:lex-mx:federal:statute:lges:article:9",
    "term_id": "urn:lex-mx:federal:statute:lges:term:estado",
    "span": "Estados",
    "start_char": 162,
    "end_char": 169
  },
  {
    "schema_version": "0.1.0",
    "id": "urn:lex-mx:federal:statute:lges:article:10:term-usage:1087-1093",
    "provision_id": "urn:lex-mx:federal:statute:lges:article:10",
    "term_id": "urn:lex-mx:federal:statute:lges:term:estado",
    "span": "Estado",
    "start_char": 1087,
    "end_char": 1093
  },
  {
    "schema_version": "0.1.0",
    "id": "urn:lex-mx:federal:statute:lges:article:12:term-usage:1586-1593",
    "provision_id": "urn:lex-mx:federal:statute:lges:article:12",
    "term_id": "urn:lex-mx:federal:statute:lges:term:estado",
    "span": "Estados",
    "start_char": 1586,
    "end_char": 1593
  },
  {
    "schema_version": "0.1.0",
    "id": "urn:lex-mx:federal:statute:lges:article:20:term-usage:187-194",
    "provision_id": "urn:lex-mx:federal:statute:lges:article:20",
    "term_id": "urn:lex-mx:federal:statute:lges:term:estado",
    "span": "Estados",
    "start_char": 187,
    "end_char": 194
  },
  {
    "schema_version": "0.1.0",
    "id": "urn:lex-mx:federal:statute:lges:article:20:term-usage:407-413",
    "provision_id": "urn:lex-mx:federal:statute:lges:article:20",
    "term_id": "urn:lex-mx:federal:statute:lges:term:estado",
    "span": "Estado",
    "start_char": 407,
    "end_char": 413
  },
  {
    "schema_version": "0.1.0",
    "id": "urn:lex-mx:federal:statute:lges:article:22:term-usage:669-675",
    "provision_id": "urn:lex-mx:federal:statute:lges:article:22",
    "term_id": "urn:lex-mx:federal:statute:lges:term:estado",
    "span": "Estado",
    "start_char": 669,
    "end_char": 675
  },
  {
    "schema_version": "0.1.0",
    "id": "urn:lex-mx:federal:statute:lges:article:28:term-usage:741-748",
    "provision_id": "urn:lex-mx:federal:statute:lges:article:28",
    "term_id": "urn:lex-mx:federal:statute:lges:term:estado",
    "span": "Estados",
    "start_char": 741,
    "end_char": 748
  },
  {
    "schema_version": "0.1.0",
    "id": "urn:lex-mx:federal:statute:lges:article:33:term-usage:3-9",
    "provision_id": "urn:lex-mx:federal:statute:lges:article:33",
    "term_id": "urn:lex-mx:federal:statute:lges:term:estado",
    "span": "Estado",
    "start_char": 3,
    "end_char": 9
  },
  {
    "schema_version": "0.1.0",
    "id": "urn:lex-mx:federal:statute:lges:article:43:term-usage:3-9",
    "provision_id": "urn:lex-mx:federal:statute:lges:article:43",
    "term_id": "urn:lex-mx:federal:statute:lges:term:estado",
    "span": "Estado",
    "start_char": 3,
    "end_char": 9
  },
  {
    "schema_version": "0.1.0",
    "id": "urn:lex-mx:federal:statute:lges:article:47:term-usage:518-525",
    "provision_id": "urn:lex-mx:federal:statute:lges:article:47",
    "term_id": "urn:lex-mx:federal:statute:lges:term:estado",
    "span": "Estados",
    "start_char": 518,
    "end_char": 525
  },
  {
    "schema_version": "0.1.0",
    "id": "urn:lex-mx:federal:statute:lges:article:49:term-usage:460-467",
    "provision_id": "urn:lex-mx:federal:statute:lges:article:49",
    "term_id": "urn:lex-mx:federal:statute:lges:term:estado",
    "span": "Estados",
    "start_char": 460,
    "end_char": 467
  },
  {
    "schema_version": "0.1.0",
    "id": "urn:lex-mx:federal:statute:lges:article:56:term-usage:781-788",
    "provision_id": "urn:lex-mx:federal:statute:lges:article:56",
    "term_id": "urn:lex-mx:federal:statute:lges:term:estado",
    "span": "Estados",
    "start_char": 781,
    "end_char": 788
  },
  {
    "schema_version": "0.1.0",
    "id": "urn:lex-mx:federal:statute:lges:article:58:term-usage:958-965",
    "provision_id": "urn:lex-mx:federal:statute:lges:article:58",
    "term_id": "urn:lex-mx:federal:statute:lges:term:estado",
    "span": "Estados",
    "start_char": 958,
    "end_char": 965
  },
  {
    "schema_version": "0.1.0",
    "id": "urn:lex-mx:federal:statute:lges:article:59:term-usage:2461-2468",
    "provision_id": "urn:lex-mx:federal:statute:lges:article:59",
    "term_id": "urn:lex-mx:federal:statute:lges:term:estado",
    "span": "Estados",
    "start_char": 2461,
    "end_char": 2468
  },
  {
    "schema_version": "0.1.0",
    "id": "urn:lex-mx:federal:statute:lges:article:62:term-usage:321-328",
    "provision_id": "urn:lex-mx:federal:statute:lges:article:62",
    "term_id": "urn:lex-mx:federal:statute:lges:term:estado",
    "span": "Estados",
    "start_char": 321,
    "end_char": 328
  },
  {
    "schema_version": "0.1.0",
    "id": "urn:lex-mx:federal:statute:lges:article:62:term-usage:371-377",